{
  "$schema": "https://json-schema.org/draft/2020-12/schema",
  "$id": "https://usd-impact.com/schemas/score-v2-1f-bls-wpu0561-ambiguity-diagnostics-preflight-authorization.schema.json",
  "title": "Score v2.1F BLS WPU0561 ambiguity diagnostics preflight authorization",
  "type": "object",
  "additionalProperties": false,
  "required": [
    "version",
    "decision_status",
    "methodology_version",
    "issue",
    "execution_scope",
    "request_budget",
    "max_economic_observations_total",
    "max_economic_observations_per_resource",
    "contact_user_agent",
    "allowed_host",
    "fixed_resources",
    "authorizations",
    "approved_by",
    "approved_at",
    "notes"
  ],
  "properties": {
    "version": {"const": 1},
    "decision_status": {"enum": ["hold", "approved"]},
    "methodology_version": {"const": "2.1F-design-candidate"},
    "issue": {"const": "https://github.com/usdimpact/usd-impact-pipeline/issues/258"},
    "execution_scope": {"const": "bls_wpu0561_ambiguity_diagnostics_preflight_only"},
    "request_budget": {"const": 2},
    "max_economic_observations_total": {"const": 0},
    "max_economic_observations_per_resource": {"const": 0},
    "contact_user_agent": {"type": ["string", "null"]},
    "allowed_host": {"const": "www.bls.gov"},
    "fixed_resources": {
      "const": [
        "/news.release/archives/ppi_05152013.htm",
        "/ppi/detailed-report/ppi-detailed-report-april-2026.xlsx"
      ]
    },
    "authorizations": {
      "type": "object",
      "additionalProperties": false,
      "required": [
        "response_body_ephemeral_retrieval",
        "ambiguity_diagnostics_preflight",
        "numeric_identifier_field_read",
        "economic_value_read",
        "full_historical_reconstruction",
        "candidate_score_computation",
        "research_ledger_mutation",
        "public_artifact_replacement",
        "production"
      ],
      "properties": {
        "response_body_ephemeral_retrieval": {"type": "boolean"},
        "ambiguity_diagnostics_preflight": {"type": "boolean"},
        "numeric_identifier_field_read": {"type": "boolean"},
        "economic_value_read": {"const": false},
        "full_historical_reconstruction": {"const": false},
        "candidate_score_computation": {"const": false},
        "research_ledger_mutation": {"const": false},
        "public_artifact_replacement": {"const": false},
        "production": {"const": false}
      }
    },
    "approved_by": {"type": ["string", "null"]},
    "approved_at": {"type": ["string", "null"]},
    "notes": {"type": "string"}
  }
}
